{
  "clarification_id": "clar_01HX0V0E8V2J8J0N5B8Q1A7W3E",
  "intent_id": "int_01HX0V0E8V2J8J0N5B8Q1A7W3E",
  "question": "Which project matches 'Sagitta'?",
  "expected_answer_type": "choice",
  "candidates": [
    { "id": "Sagitta - Loft", "label": "Sagitta - Loft", "meta": { "project_id": "proj_1" } },
    { "id": "Sagitta - Flooring", "label": "Sagitta - Flooring", "meta": { "project_id": "proj_2" } }
  ],
  "status": "open"
}
